[
  {"schema_version":"1.0.0","decision_id":"dec_0000000000000001","request_id":"req_0000000000000001","decided_at":"2026-01-01T00:00:01Z","disposition":"single","match_disposition":"specific_match","selected_protocol_ids":["example-deploy"],"candidates":[{"protocol_id":"example-deploy","rank":1,"evidence":["lexical-trigger","priority"],"authorization_basis":"deterministic-rule","reason_codes":["SPECIFIC_TRIGGER"]}],"reasons":[{"code":"SPECIFIC_TRIGGER","summary":"A specific public fixture trigger matched."}]},
  {"schema_version":"1.0.0","decision_id":"dec_0000000000000002","request_id":"req_0000000000000002","decided_at":"2026-01-01T00:00:02Z","disposition":"composite","match_disposition":"composite_match","selected_protocol_ids":["example-config","example-deploy"],"plan_id":"pln_0000000000000002","candidates":[{"protocol_id":"example-config","rank":1,"evidence":["lexical-trigger"],"authorization_basis":"explicit"},{"protocol_id":"example-deploy","rank":2,"evidence":["lexical-trigger"],"authorization_basis":"explicit"}],"reasons":[{"code":"COMPOSITION_REQUIRED","summary":"Two explicit fixture operations must execute in order."}]},
  {"schema_version":"1.0.0","decision_id":"dec_0000000000000003","request_id":"req_0000000000000003","decided_at":"2026-01-01T00:00:03Z","disposition":"ambiguous","match_disposition":"ambiguous","selected_protocol_ids":[],"requires_operator_resolution":true,"candidates":[{"protocol_id":"example-a","rank":1,"score":0.8,"evidence":["semantic-retrieval"],"authorization_basis":"semantic-support-only"},{"protocol_id":"example-b","rank":2,"score":0.8,"evidence":["semantic-retrieval"],"authorization_basis":"semantic-support-only"}],"reasons":[{"code":"UNRESOLVED_TIE","summary":"Equal candidates require operator resolution."}]},
  {"schema_version":"1.0.0","decision_id":"dec_0000000000000004","request_id":"req_0000000000000004","decided_at":"2026-01-01T00:00:04Z","disposition":"fallback","match_disposition":"wildcard_fallback","selected_protocol_ids":["conversational"],"candidates":[{"protocol_id":"conversational","rank":1,"evidence":["wildcard"],"authorization_basis":"deterministic-rule"}],"reasons":[{"code":"WILDCARD_ONLY","summary":"No specific route matched the sanitized fixture."}]},
  {"schema_version":"1.0.0","decision_id":"dec_0000000000000005","request_id":"req_0000000000000005","decided_at":"2026-01-01T00:00:05Z","disposition":"none","match_disposition":"no_route","selected_protocol_ids":[],"candidates":[],"reasons":[{"code":"UNSUPPORTED_REQUEST","summary":"No public fixture route supports the request class."}]},
  {"schema_version":"1.0.0","decision_id":"dec_0000000000000006","request_id":"req_0000000000000006","decided_at":"2026-01-01T00:00:06Z","disposition":"none","match_disposition":"routing_error","selected_protocol_ids":[],"candidates":[],"reasons":[{"code":"INDEX_UNAVAILABLE","summary":"The fixture router could not load its index."}],"error":{"code":"INDEX_UNAVAILABLE","retryable":true}}
]
